name,description,image,adapts_well_to_apartment_living,good_for_novice_owners,sensitivity_level,tolerates_being_alone,tolerates_cold_weather,tolerates_hot_weather,affectionate_with_family,kid_friendly,dog_friendly,friendly_toward_strangers,amount_of_shedding,drooling_potential,easy_to_groom,general_health,potential_for_weight_gain,size,easy_to_train,intelligence,potential_for_mouthiness,prey_drive,tendency_to_bark_or_howl,wanderlust_potential,energy_level,intensity,exercise_needs,potential_for_playfulness,dog_breed_group,height,weight,life_spanestrela mountain dog,"The Estrela Mountain Dog is a purebred dog from the Estrela Mountains of Portugal. Courageous, protective, and loyal, these pups have some of the best qualities of most dog breeds around today.The Estrela Mountain Dog goes by several names, including Portuguese Shepherd and Cao da Serra da Estrela. These large, beautiful dogs live primarily in their homeland of Portugal, but you might still find them in local shelters and breed specific rescues. Remember to adopt! Dont shop!These adorable pups are quite large and suited for larger homes, preferably with yards to roam. They might not be well suited for apartment living. Theyre loyal and protective, which makes them great for households of all sizes. If you want a loving companion who will guard your home and family and alert you to any potential dangers, then this beautiful pooch might be right for you!",https://www.dogtime.com/assets/uploads/2019/11/estrela-mountain-dog-breed-pictures-cover.jpg,1,3,2,3,4,3,5,5,3,2,4,3,2,4,3,4,4,5,2,1,3,1,3,3,3,3,Herding Dogs,24 to 30 inches,75 to 130 pounds,11 to 15 years
eurasier,"The Eurasier is a breed of medium-sized dogs of the Spitz type that first came from Germany. These dogs are known to be very smart, loyal, and even-tempered.Eurasiers can go by many other names such as Eurasian, Eurasian Spitz, Eurasian dog, and most notably, Wolf-Chow. You can find Eurasier dogs in shelters and breed specific rescues, so remember to adopt!These dogs are very solid watchdogs and pack-oriented, which makes them ideal for those with families and even kids. However, Eurasiers dont do well when left alone, especially in a room by themselves. They do best when they are part of a family and, when left on their own, can grow anxious and depressed.",https://www.dogtime.com/assets/uploads/2019/08/eurasier-dog-breed-pictures-cover.jpg,4,3,2,1,4,3,3,5,4,2,4,3,3,4,2,4,4,4,2,1,2,1,3,2,3,3,Companion Dogs,20 to 24 Inches,40 to 71 lbs,12 to 14 years
field spaniel,"The sturdy, medium-sized Field Spaniel dog breed was originally developed to retrieve game from land or water. Today, while they retain their excellent hunting skills, theyre mainly family companions and show dogs and are rarely seen in the field.These dogs love people and are loyal family friends. However, they do not fair as well in apartments due to their high energy and exercise needs. If you decide this is the breed for you, make sure your dog has plenty of space to run and play, and keep up with daily walks!DogTime recommends this dog bed to give a good nights sleep to your medium-sized Field Spaniel.You should also pick up this dog water bottle for any outdoor adventures you have with your pup!",https://www.dogtime.com/assets/uploads/2011/01/file_22972_field-spaniel-460x290.jpg,1,3,4,1,3,4,5,5,4,4,3,1,4,3,4,2,5,5,3,4,2,5,5,3,5,5,Sporting Dogs,"1 foot, 4 inches to 1 foot, 7 inches tall at the shoulder",37 to 45 pounds,10 to 12 years
fila brasileiro,"The Fila Brasileiro was developed in Brazil centuries ago as a large game hunting dog and working dog. These large dogs can be intimidating, but there is a reason why the saying, faithful as a Fila exists in Brazil.This breed is also known as the Brazilian Mastiff,Brazilian Bloodhound, Cao de Brasil, Cao de Fila, and the Fila. Although these are purebred dogs, you may still find them in shelters and rescues. Remember to adopt! Dont shop if this is the breed for you.This massive dog probably isnt the best choice for novice pet parents or people who live in apartments, as the Fila Brasileiro needs firm, experienced training and a lot of space to run around. The breed is banned in several countrieswhere these dogs are considered aggressive. But for an experienced large dog owner whos ready to devote a serious amount of time to training and socialization, the Fila Brasileiro can make a wonderful companion and watchdog.DogTime recommends this big, spacious crate to give your big Fila Brasileiro a place to rest and relax.You should also pick up this dog brush and massager for your short-haired pup!",https://www.dogtime.com/assets/uploads/2020/06/Fila-Brasileiro-dog-breed-pictures-1-1442x961.jpg,1,1,3,3,2,3,3,3,2,1,2,3,4,3,4,5,2,4,3,5,3,3,4,4,4,2,Working Dogs,24 to 30 inches,90 to 180 pounds,9 to 12 years
finnish lapphund,"Believe it or not, the hard-working Finnish Lapphunddog breed earned their keep herding reindeer in their native Lapland, in the far north of Finland. Friendly and gentle, the breed retains a strong herding instinct.Even though these are purebred dogs, you may find them in the care of shelters or rescue groups. Remember toadopt! Dont shop if you want to bring a dog home.As you may have guessed, Finnish Lapphunds fair well in cold climates. Theyre also highly affectionate with their families, even kids and other dogs. They do, however, need plenty of exercise. Playtime, walks, and dog sports will keep your pup happy and entertained.",https://www.dogtime.com/assets/uploads/2011/01/file_23258_finnish-lapphund-460x290.jpg,4,4,4,2,5,2,5,5,5,4,3,1,4,4,4,3,5,5,4,4,3,4,5,5,4,5,Herding Dogs,17 to 20 inches tall at the shoulder,33 to 53 pounds,12 to 15 years
finnish spitz,"Finnish Spitz were originally were bred to hunt a variety of small and large game, and then bark when they found something. Today theyre considered talkative companions who will keep you apprised of just about everything going on in your surroundings.Even though these are purebred dogs, you may find them in the care of shelters or rescue groups. Remember toadopt! Dont shop if you want to bring a dog home.These dogs are very loving and playful, but they do require firm, consistent training. That may prove difficult with their independent streak, and theyll need a securely fenced yard because they love to bark at people and animals who walk past  and sometimes even chase them. If you can meet the breeds needs, youll have an affectionate, playful companion who still acts like a puppy well into adulthood.",https://www.dogtime.com/assets/uploads/2011/01/file_23148_finnish-spitz-460x290.jpg,3,3,3,1,5,3,5,5,5,3,4,1,2,4,3,3,3,4,3,3,5,4,5,4,5,5,Sporting Dogs,15 to 20 inches tall at the shoulder,20 to 35 pounds,12 to 15 years
flat-coated retriever,"The Flat-Coated Retriever was originally developed as a dual-purpose retriever of game on land and from water, and theyre still popular for that purpose today.They also compete in obedience, rally, and agility, are super therapy dogs, and are ideal companions for people who are looking for an active dog breed. Apartment dwellers should beware, however, as these pups definitely need room to run and play. Keep up with daily walks to meet this breeds high exercise needs.DogTime recommends this dog bed to give a good nights sleep to your medium-sized Flat-Coated Retriever.You should also pick up this dog fetch toy to help burn off your pups high energy!",https://www.dogtime.com/assets/uploads/2011/01/file_22974_flat-coated-retriever-460x290.jpg,1,2,5,1,4,4,5,5,5,5,3,2,4,4,4,3,4,5,3,3,4,4,5,4,5,5,Sporting Dogs,"1 foot, 10 inches to 2 feet tall at the shoulder",55 to 70 pounds,10 to 12 years
fox terrier,"The Fox Terrier was originally bred to flush foxes out of their hiding places during fox hunts. Today theyre primarily family companions and show dogs, although youll occasionally find them in the hunt country of the northeastern United States, still performing their traditional role.Although these are purebred dogs, you may still find them in shelters and rescues. Remember to adopt! Dont shop if you want to bring a dog home.Fox Terriers are highly intelligent dogs, and they have plenty of energy. Theyd do best with humans who can provide them with lots of exercise and playtime, or else they might find their own ways to stay entertained with unwanted behaviors. Keep your pooch physically and mentally stimulated, and youll have a loving, playful companion.",https://www.dogtime.com/assets/uploads/2011/01/file_23094_fox-terrier-460x290.jpg,3,3,3,3,3,4,4,4,3,3,2,1,2,4,2,2,5,5,3,5,3,3,5,5,5,5,Terrier Dogs,Up to 15 inches tall at the shoulder,15 to 19 pounds,10 to 15 years
french bulldog,"The French Bulldog has enjoyed a long history as a companion dog. Created in England to be a miniature Bulldog, they accompanied English lacemakers to France, where they acquired their Frenchiemoniker.Although this is a purebreddog breed, you may find them in shelters and rescues. Opt to adopt if you can!Besides being companions, they once served as excellent ratters, but today their job focuses on being fabulous family friends and show dogs. Even apartment dwellers and first-time pet parents will love this affectionate breed.Its important to remember that dogs of any breed can suffer from health issues throughout their lives. A good pet insurance plan can help you prepare to give your dog the care they need at any age. Click here to get a pet insurance plan for your French Bulldog!",https://www.dogtime.com/assets/uploads/2011/01/file_23150_french-bulldog-460x290.jpg,5,5,3,1,2,1,5,4,4,4,3,1,5,2,4,2,4,3,3,2,3,2,3,4,2,5,Companion Dogs,11 to 12 inches tall at the shoulder,16 to 28 pounds,11 to 14 years
french bullhuahua,"The French Bullhuahua is a mixed breed doga cross between the Chihuahua and French Bulldog breeds. Compact, spunky, and loyal, these pups inherited some of the best qualities from both of their parents.French Bullhuahuas go by several names, including Frencheenie, Chibull, and Mexican Frenchie. Despite their unfortunate status as a designer breed, you can find these mixed breed dogs in shelters and breed specific rescues, so remember to adopt! Dont shop!These cute pups make excellent apartment dogs for urban dwellers, and they also fare well in small or single-person households. These little firecracker dogs can be somewhat vocal or yappy, making them great alert dogs. If you want a spunky snuggle buddy who will keep you on your toes and love you unconditionally, the French Bullhuahua may be the right dog for you!Check out this de-shedding tool, perfect for this mixed breeds short hair! Or this harness that will fit your French Bullhuahuas smaller frame!",https://www.dogtime.com/assets/uploads/2020/03/french-bullhuahua-mixed-dog-breed-pictures-cover.jpg,4,3,3,2,2,4,4,3,2,3,3,2,4,4,5,1,3,3,4,3,4,2,3,3,3,4,Mixed Breed Dogs,6 to 12 inches,10 to 30 pounds,10 to 15 years
french spaniel,"The French Spaniel is a purebred dog from France and Canada. These dogs are sociable, intelligent, and gentle, which make up some of the best qualities in any pooch.The French Spaniel goes by several names, including Epagneul Francais, French Setter, and Canadian Setter. Despite their status as a pure breed, you may find these dogs in shelters and rescues, so remember to adopt! Dont shop!These beautiful dogs make great companions for those who are naturally active. They are not well-suited for apartment living as they need space to run and expend their energy. They are great pets for any type of household, including families with children of all ages. If you want an energetic and active dog who will keep you on your toes, then this breed might be right for you!",https://www.dogtime.com/assets/uploads/2019/08/french-spaniel-dog-breed-picture-cover.jpg,2,4,4,3,4,2,5,4,4,4,3,2,3,4,2,3,4,4,2,3,2,2,5,3,4,4,Sporting Dogs,21 to 24 inches.,45 to 60 pounds.,10 to 12 years.
frenchton,"The Frenchton is a mixed breed dog  a cross between the Boston Terrier and French Bulldog breeds.Sturdy, sociable, playful, and chill, these pups inherited some of the best qualities from both of their parents.Frenchtons are also called Frenchbo, Faux Frenchbo, and Froston. Despite their unfortunate status as a designer breed, you can find these pups, in shelters and breed-specific rescues, so remember to adopt. Dont shop!These outgoing pups are total charmers. Theyre easy traveling companions and could join their families on every adventure. Theyre also sweet-natured and love children of all ages.With plenty of love and some activities, a Frenchton would easily adapt to a small apartment. If you work long hours and would be away from your pup, however, this would not be the right dog for you. But if you work in a place that would allow you to bring your pup with you, this laid-back dog would love to join you and hang out wherever you are.",https://www.dogtime.com/assets/uploads/2020/01/frenchton-mixed-dog-breed-pictures-cover.jpg,5,5,3,2,3,3,5,5,5,5,4,3,5,4,2,2,4,4,2,2,3,3,3,3,3,5,Mixed Breed Dogs,11 to 14 inches,15 to 25 pounds,12 to 15 years
frengle,"The Frengle is a mixed dog breeda cross between the French Bulldog andBeagle dog breeds. Charismatic, affectionate, and even-tempered, these pups inherited some of the best qualities from both of their parents.Frengles can also go by the name French Bulldog Beagle mix but rarely go by any other names. Despite their unfortunate status as a designer dog breed, you can find these mixed breed dogs in shelters and breed specific rescues, so remember to adopt! Dont shop!These good-natured pups are quite adaptable and make great apartment dogs as long as theyre walked daily, but they will also enjoy living in a home with a backyard. Theyre not yappy dogs but will bark to alert their owners of any intruders. If you want a social, energetic, loyal, and fun-loving dog, the Frengle may be the right dog for you!",https://www.dogtime.com/assets/uploads/2020/02/frengle-mixed-dog-breed-pictures-cover.jpg,4,4,4,3,2,2,5,5,4,4,3,1,5,4,4,3,3,4,3,3,2,3,4,3,4,5,Mixed Breed Dogs,8 to 15 inches,18 to 30 pounds,10 to 15 years
german longhaired pointer,"The German Longhaired Pointer is a multipurpose hunting dog breed that Germans started selectively breeding for their versatility and athleticism. Today, the German Longhaired Pointer, or GLP, is a gentle, loyal breed.Some fans of the breed refer to them simply as GLP. In their native country, theyre calledDeutsch-Langhaar, or the German Longhair.Although these are purebred dogs, you may still find them in shelters and rescues. Remember to adopt! Dont shop if this is the breed for you.As long as a German Longhaired Pointer gets plenty of exercise, this breed makes an amazing petfor active singles and families alike. They thrive in homes with yards or plenty of space to run, sniff, and romp. If youre looking for a loyal dog who will keep you as active as ever, the German Longhaired Pointer just might be the right breed for you!DogTime recommends this big, spacious crate to give your big GLP a place to rest and relax. You should also pick up this dog fetch toy to help burn off your pups high energy!",https://www.dogtime.com/assets/uploads/2020/05/german-longhaired-pointer-dog-breed-pictures-cover.jpg,2,2,3,3,3,2,5,4,4,4,2,3,5,4,4,4,4,4,2,3,3,4,5,3,5,3,Sporting Dogs,23 to 28 inches,60 to 71 pounds,11 to 14 years
german pinscher,"The German Pinscher dog breed is muscular and agile, powerful yet graceful. A medium-sized dog with an elegant appearance, theyre admired as much for their beauty as for their intelligence.As the name implies, these pups originated in Germany. Although this is a pure breed of dog, you may find them in shelters and rescues, so remember to adopt! Dont shop if you decide this is the dog for you.German Pinschers are working dogs, guard dogs, and devoted and loving family dogs. Although they can adapt to many living situations, their high intelligence and energy levels mean they will need lots of exercise. A home with a yard to run would be ideal.DogTime recommends this dog bed to give a good nights sleep to your medium-sized German Pinscher. You should also pick up this dog fetch toy to help burn off your pups high energy!",https://www.dogtime.com/assets/uploads/2011/01/file_22922_german-pinscher-460x290.jpg,3,3,4,3,3,4,5,3,2,2,3,1,5,4,3,3,4,5,3,5,3,4,5,3,5,5,Working Dogs,17 to 20 inches tall at the shoulder,25 to 45 pounds,12 to 14 years
german shepherd dog,"The German Shepherd Dog is one of Americas most popular dog breeds for good reasons. Theyre intelligent and capable working dogs. Their devotion and courage are unmatched. And theyre amazingly versatile.The breed also goes by the name Alsatian. Despite their purebred status, you may find German Shepherds in shelters and breed specific rescues. So remember to adopt! Dont shop if this is the breed for you.GSDs excel at most anything theyre trained to do: guide and assistance work for the handicapped, police and military service, herding, search and rescue, drug detection, competitive obedience, and  last but not least  faithful companion.Any type of dog can develop arthritis or slow down in old age. DogTime recommendsgiving your dog Glyde Mobility Chewsto keep their joints healthy!See below for all dog breed traits and facts about German Shepherds!",https://www.dogtime.com/assets/uploads/2011/01/file_23188_german-shepherd-dog-460x290.jpg,3,2,5,2,4,3,5,5,2,4,5,1,5,4,2,4,5,5,5,4,4,2,5,5,5,5,Herding Dogs,"1 foot, 10 inches to 2 feet, 2 inches tall at the shoulder",75 to 95 pounds,10 to 14 years
german shepherd pit bull,"The German Shepherd Pit Bull is a mixed breed doga cross between theGerman Shepherd Dogand American Pit Bull Terrier breeds. Medium to large in size, energetic, and loyal, these pups inherited some of the best traits from both of their parents.The German Shepherd Pit Bull is also sometimes called the German Sheppit, German Pit, and Shepherd Pit. Despite their unfortunate status as a designer breed, you may find these pups in shelters and breed specific rescues, so remember to adopt! Dont shop!These pups are friendly in nature when they have proper socialization training, and theyre loyal to a fault. Both parent breeds are hard working dogs. Due to their superior intelligence and athletic build they are often tasked with guarding and police work.An apartment probably wouldnt do for these pups. German Shepherd Pit Bulls need large homes with yards to run around. If given rigorous duties, youll have one happy dog. When under-stimulated, these pups can become destructive and develop behavioral problems.DogTime recommends this dog bed to give a good nights sleep to your medium-sized German Shepherd Pit Bull.You should also pick up this dog water bottle for any outdoor adventures you have with your pup!",https://www.dogtime.com/assets/uploads/2020/02/german-shepherd-pit-bull-mixed-dog-breed-pictures-COVER.jpg,1,1,4,1,3,3,5,5,4,4,5,1,5,4,4,4,5,5,5,4,4,3,5,5,5,5,Mixed Breed Dogs,17 to 26 inches,30 to 90 pounds,10 to 12 years
german shepherd rottweiler mix,"The German Shepherd Rottweiler Mix is a a cross between the German Shepherd and Rottweiler dog breeds. Eenergetic, loyal, and as eager to play as they are to snuggle, these mixed breed pups inherited some of the best qualities from both of their parents.German Shepherd Rottweiler Mixes go by several different names, like the Rottie Shepherd or Rotten Shepherda misnomer in terms of how loving and fun this mixed breed can be. Despite their unfortunate status as a designer breed, you may find these mixed breed dogs in shelters and breed specific rescues, so remember to adopt! Dont shop!These fluffy pups make great family dogs; however, theyre best suited to homes that have access to a yard and space. Still, they can make great companions for active urban dwellers, too. If you want a goofy, kid-friendly dog who loves to play as much as they love to look out for their family, the German Shepherd Rottweiler Mix might be the right dog for you!DogTime recommends this big, spacious crate to give your big German Shepherd Rottweiler Mix a place to rest and relax.You should also pick up this dog fetch toy to help burn off your pups high energy!",https://www.dogtime.com/assets/uploads/2020/04/german-shepherd-rottweiler-mixed-dog-breed-pictures-cover.jpg,3,4,3,3,4,2,4,4,3,3,5,3,3,3,4,4,3,4,3,3,3,2,4,3,4,4,Mixed Breed Dogs,22 to 28 inches,75 to 115 pounds,9 to 13 years
german sheprador,"The German Sheprador is a mixed breed dog  a cross between the German Shepherd and Labrador Retriever dog breeds. Large, energetic, and loyal, these pups inherited some of the best qualities from both of their parents.The German Sheprador is also called the Labrashepherd. Despite their unfortunate status as a designer breed, you may find these mixed breed dogs in shelters and rescues, so remember to adopt! Dont shop!German Shepradors are not a great choice for novice pet owners, but if youre looking for a watch dog and family companion, please step right up! Big homes with yards are ideal but not required, as long as they exercise. While Shepradors are not excessively barky they will alert when strangers approach. Theyre protective of their loved ones and friendly with people, children, and other dogs. Dont leave them alone for long periods, though, or else they may become bored and destructive. Read on to learn more about the German Sheprador.",https://www.dogtime.com/assets/uploads/2019/09/german-sheprador-mixed-dog-breed-pictures-cover.jpg,2,1,5,2,4,4,5,5,4,4,5,2,5,3,3,4,5,5,5,3,2,2,5,5,5,5,Mixed Breed Dogs,20 to 27 inches,60 to 95 pounds,10 to 12 years
german shorthaired pointer,"The versatileGerman Shorthaired Pointersporting dogbreed hunts many types of game, retrieves on land or from water, and is an affectionate companion. They have a striking, easy-care coat, but they need plenty of vigorous exercise.If you can provide this dog with the mental and physical challenges they crave, theyll be your best four-legged friend. But those who live in apartments or spend lots of time away from home must beware. Without room to play and lots of exercise, you may find a bored dog engaging in destructive behaviors when you get home.DogTime recommends this dog bed to give a good nights sleep to your medium-sized German Shorthaired Pointer.You should also pick up this dog fetch toy to help burn off your pups high energy!",https://www.dogtime.com/assets/uploads/2011/01/file_22976_german-shorthaired-pointer-460x290.jpg,1,2,4,1,2,4,5,5,4,3,2,2,5,3,3,3,5,5,4,5,3,5,5,3,5,5,Sporting Dogs,"1 foot, 9 inches to 2 feet, 1 inch tall at the shoulder",45 to 70 pounds,12 to 15 years
german spitz,"The German Spitz is one of the oldest dog breeds originating from Europe. Attentive, energetic, and devoted, these pups have some of the best qualities among any dog breed around.German Spitzes go by several other names such as Spitz, German Spitz Mittelspitz, and Deutscher Spitz. If youd like to bring home a dog of this breed, look for them at your local shelter or rescue. Remember, adopt a pup, and dont shop!These adorable pooches can make great apartment dogs due to their small stature and are suited for any type of household or family, though they have a tendency to be yappy. If you want an energetic firecracker dog who will keep you on your toes, alert you to any potential dangers, and love you unconditionally, this may be the right dog for you!",https://www.dogtime.com/assets/uploads/2019/10/german-spitz-dog-breed-pictures-cover.jpg,4,2,3,3,3,2,5,4,3,3,4,1,2,4,4,1,2,4,4,5,4,2,5,3,4,4,Companion Dogs,12 to 15 inches,21 to 29 pounds,13 to 15 years
german wirehaired pointer,"The German Wirehaired Pointer was developed in the late 19th and early 20th centuries to be a versatile hunting dog breed, a job at which they still excel today. They can hunt any game on any terrain and point and retrieve from land or water.Their excellent noses and stamina are appreciated by hunters worldwide, but theyre also great companions for active families who can provide an outlet for this dogs high energy levels.DogTime recommends this dog bed to give a good nights sleep to your medium-sized German Wirehaired Pointer.You should also pick up this dog fetch toy to help burn off your pups high energy!",https://www.dogtime.com/assets/uploads/2011/01/file_22978_german-wirehaired-pointer-460x290.jpg,2,3,4,2,3,4,5,3,3,2,2,2,4,4,3,4,4,5,4,4,3,5,5,4,5,5,Sporting Dogs,"1 foot, 10 inches to 2 feet, 2 inches tall at the shoulder",60 to 70 pounds,12 to 14 years
giant schnauzer,"The Giant Schnauzer was created to be a working dog breed, so they have intelligence and drive. They can be a loyal and courageous companion for the person who can provide them with the training, exercise, and attention they need.These pups originated in Germany, where they had jobs like driving cattle, working in butcher shops and stockyards, and even guarding breweries. Although this is a pure breed of dog, you may find them in shelters and rescues, so remember to adopt! Dont shop if you decide this is the dog for you.Giant Schnauzers love to play and have high energy. They do best in homes with big yards to run and get plenty of exercise. Apartment life generally isnt for them, and novice trainers beware. However, if you want a loyal guardian and energetic companion, this pooch may be your new best friend!DogTime recommends this big, spacious crate to give your big Giant Schnauzer a place to rest and relax.You should also pick up this dog fetch toy to help burn off your pups high energy!",https://www.dogtime.com/assets/uploads/2011/01/file_22924_giant-schnauzer-460x290.jpg,1,1,4,2,4,2,5,3,3,2,4,1,2,4,3,4,5,4,3,4,4,4,5,2,5,5,Working Dogs,23 to 27 inches tall at the shoulder,55 to 80 pounds,10 to 12 years
