name,description,image,adapts_well_to_apartment_living,good_for_novice_owners,sensitivity_level,tolerates_being_alone,tolerates_cold_weather,tolerates_hot_weather,affectionate_with_family,kid_friendly,dog_friendly,friendly_toward_strangers,amount_of_shedding,drooling_potential,easy_to_groom,general_health,potential_for_weight_gain,size,easy_to_train,intelligence,potential_for_mouthiness,prey_drive,tendency_to_bark_or_howl,wanderlust_potential,energy_level,intensity,exercise_needs,potential_for_playfulness,dog_breed_group,height,weight,life_spannorwegian elkhound,"The gorgeous Norwegian Elkhounddog breed, with their wolf-like face, delights in life. Smart as can be, they also have a wonderful sense of humor. Theyll race you around the kitchen island, reverse directions when you do, and then howl for sheer fun.Even though these are purebred dogs, some may still end up in the care of shelters or rescues. Consider adoption if this is the breed for you.Bold, energetic, and protective, the Norwegian Elkhound makes an excellent watchdog and guardian. Elkhounds are utterly devoted to their families. When youre upset, this tenderhearted Viking will plop their head on your lap. Adaptable and affectionate, both experienced pet parents and novices will find it easy to fall in love with these dogs. Just make sure you can provide plenty of exercise to meet their high energy levels. Oh, and prepare to deal with quite a bit of shedding.DogTime recommends this dog bed to give a good nights sleep to your medium-sized Norwegian Elkhound.You should also pick up this dog de-shedder for your high shedding pup!",https://www.dogtime.com/assets/uploads/2011/01/file_23032_norwegian-elkhound-460x290.jpg,4,4,4,2,5,3,5,4,4,4,5,1,3,4,4,3,2,4,3,4,4,4,5,3,5,4,Hound Dogs,19 to 20 inches tall at the shoulder,12 to 15 years,
norwegian lundehund,"With six toes on each foot  all of them double- or triple-jointed  and an amazing range of motion, the agileNorwegian Lundehunddog breed was used to scale cliffs and rob puffin nests of their eggs.Although these are purebred dogs, you may find them in the care of shelters or rescue groups. Remember to adopt! Dont shop if you want to bring a dog home!Along with the Norwegian Lundehunds acrobatic talents, they have a knack for barking and digging, making them a good choice only if youre prepared to give them lots of supervision and training. They can be very tough to housetrain. Experienced pet parents only!",https://www.dogtime.com/assets/uploads/2011/01/file_23276_norwegian-lundehund-460x290.jpg,1,1,3,2,5,3,5,5,5,5,5,1,4,3,3,3,4,5,3,2,1,5,4,4,5,5,Working Dogs,"1 foot to 1 foot, 3 inches tall at the shoulder",13 to 16 pounds,10 to 12 years
norwich terrier,"The Norwich Terrier originated as a ratter on farms but moved up in the world to bolt foxes from their dens during hunts. Today, theyre amusing companions who serve double duty by keeping your home and yard free of rats and other vermin.Although these are purebred dogs, you may still find them in shelters and rescues. Remember to adopt! Dont shop if this is the breed for you.These highly affectionate dogs make for great apartment pets, and theyll get along with everybody, including kids, other dogs, and even strangers who come to your door. Make no mistake, though. These pups have high energy and need to stay physically active, and they wont appreciate being left home alone for long hours. Give your Norwich plenty of exercise to keep them fit and happy, and youll have a loyal, loving best friend for life!DogTime recommends this carrier for traveling with your small Norwich Terrier.You should also pick up this interactive puzzle toy to keep your pup active indoors!",https://www.dogtime.com/assets/uploads/2011/01/file_23078_norwich-terrier-460x290.jpg,5,3,4,2,4,4,5,5,5,5,2,1,2,4,5,1,4,4,4,3,4,4,5,4,4,5,Terrier Dogs,Up to 10 inches tall at the shoulder,Up to 12 pounds,10 to 14 years
nova scotia duck tolling retriever,"The Nova Scotia Duck Tolling Retriever dog breed was created to both lure and retrieve waterfowl. This versatile breed excels in the field and show ring, in obedience and agility, and as a companion to an active family.Highly adaptable and affectionate, these dogs can even fair well in apartments, so long as their humans can keep up with providing enough exercise and lots of daily walks. Without adequate activity, they can end up growing bored and acting out with unwanted behaviors.DogTime recommends this dog bed to give a good nights sleep to your medium-sized Nova Scotia Duck Tolling Retriever.You should also pick up this dog water bottle for any outdoor adventures you have with your pup!",https://www.dogtime.com/assets/uploads/2011/01/file_22990_nova-scotia-duck-tolling-retriever-460x290.jpg,5,3,3,2,4,4,5,5,4,4,3,1,5,4,4,3,4,5,4,5,4,3,5,3,5,5,Sporting Dogs,"1 foot, 5 inches to 1 foot, 9 inches tall at the shoulder",35 to 50 pounds,10 to 14 years
old english sheepdog,"The Old English Sheepdog is a large, athletic dog breed with an unmistakable shaggy coat. The OES, as fans call the breed for short, was historically a drover, helping farmers drive cattle and sheep to the market. Today, this good-natured dog enjoys the comfort of home life and still competes in conformation, obedience, agility, and herding trials.Even though these are purebred dogs, you may find them in the care of shelters or rescue groups. Remember toadopt! Dont shop if you want to bring a dog home.The OES is an adaptable, intelligent dog with an easygoing disposition. Theyre affectionate with all members of their families, and despite the fact that they are large dogs, they can fit in well with apartment life so long as they get enough exercise from walks and play sessions. Their shaggy coats also dont tend to shed as much as you might think. If youre looking for a loyal, protective, and loving family companion, this may be the breed for you!",https://www.dogtime.com/assets/uploads/2011/01/file_23190_old-english-sheepdog-460x290.jpg,5,4,4,2,4,2,5,4,4,4,1,4,1,4,4,4,3,4,2,3,1,2,4,3,4,4,Herding Dogs,From 21 inches tall at the shoulder,10 to 12 years,
otterhound,"The large and rough-coated Otterhound was originally bred for hunting otter in England. Built for work, the dog breed has a keen nose and renowned stamina.This is an uncommon breed, with fewer than ten litters born each year in the United States and Canada. Stillsome may still end up in the care of shelters or rescues. Consider adoption if this is the breed for you.Otterhounds are also playful clowns, friendly and affectionate with their families. They even love kids and other dogs, and they crave playtime and plenty of exercise to burn off their high energy. In fact, apartment dwellers will find it very difficult to provide enough space for them to run and move. But those who have room to roam and love to give will be rewarded with a loving companion who will never fail to delight their humans with silly antics and fun.DogTime recommends this big, spacious crate to give your big Otterhound a place to rest and relax. You should also pick up this dog water bottle for any outdoor adventures you have with your pup!",https://www.dogtime.com/assets/uploads/2011/01/file_23034_otterhound-460x290.jpg,1,4,2,5,4,3,5,5,5,4,4,1,2,4,3,4,2,4,3,5,2,5,5,4,5,5,Hound Dogs,24 to 27 inches tall at the shoulder,10 to 12 years,
papillon,"The Papillon dog breed descends from the toy spaniels that are frequently portrayed in paintings by the Old Masters, from as far back as the 16th century. Theyre highly active and wonderful competitors in agility and obedience.Even though these are purebred dogs, you may find them in the care of shelters or rescue groups. Remember toadopt! Dont shop if you want to bring a dog home.The breeds sparkling personality makes these dogs a favorite of all who meet them. Even though you might think of Papillons as lap dogs, these poochs are active and playful, and they wont be content lounging on the couch with you all day. They do, however, love companionship and will always try to be where their humans are. This is not the breed for you if youre away from home for long hours of the day. Meet the breeds needs, and youll have a loving companion who wont want to leave your side!",https://www.dogtime.com/assets/uploads/2011/01/file_23118_papillon-460x290.jpg,5,5,3,1,2,4,5,3,4,5,2,1,3,3,3,1,5,4,3,4,2,1,4,3,5,5,Companion Dogs,8 to 11 inches tall at the shoulder,4 to 9 pounds,12 to 16 years
papipoo,"The Papipoo is a mixed breed dog  a cross between the Papillon and Poodle dog breeds. Loving, intelligent, and active, this devoted, little dog wants to be part of all family activities.Papipoos are also known as Papoodles,Papi Doodles, Papidoodles, and Papi Poos.Theyre considered designer dogs, making them in high demand, which also means theyre readily found in shelters or rescues. Please adopt if youd like to add one of these pups to your life. Remember, when you adopt, you save two livesthe one you bring home and the one you make room for at the shelter.As a cross between old-world breeds known for their intelligence and athleticism, the Papipoo has it all, with brains and brawn, not to mention beauty. Although these dogs are active, their size lends well to any dwelling, including small apartments. Their sociability makes them a good fit for all types of families, provided they get attention throughout the day. If you want an affectionate, little lapdog who may also be a contender for the Canine Olympics, this may be a perfect dog for you!",https://www.dogtime.com/assets/uploads/2020/01/papipoo-mixed-dog-breed-pictures-cover-1.jpg,5,5,4,1,2,4,5,3,4,4,1,1,2,3,3,1,5,5,3,3,2,2,5,3,5,5,Mixed Breed Dogs,10 to 11 inches,6 to 14 pounds,10 to 14 years
patterdale terrier,"The spunky and energetic Patterdale Terrier is a very popular dog in the United States but originated in the United Kingdom. Compact, confident, and independent, this beloved dog was originally bred to hunt foxes and rabbits.Although these are purebred dogs, you may still find them in shelters and rescues. Remember to adopt! Dont shop if this is the breed for you.Patience is much needed when it comes to training as these dogs have a reputation for being stubborn. However, theyre charming and affectionate and will form strong bonds with their main caregiver.These adorable pups love big and small families alike as long as they get plenty of attention  because they will demand it! That said, large families might work best for them because there are more people to interact with, and Patterdale Terriers dont like being left alone for any length of time. This is a high energy dog and would not be happy in a low energy family.A large home with a backyard or countryside is ideal. Make sure you have a secure yard, as theyre prone to tracking and wandering off.",https://www.dogtime.com/assets/uploads/2020/07/patterdale-terrier-dog-breed-pictures-cover.jpg,1,2,4,1,4,4,4,4,4,4,2,1,4,4,3,2,3,5,4,5,2,4,4,4,4,4,Terrier Dogs,12 to 15 inches,11 to 13 pounds,11 to 14 years
peekapoo,"A Peekapoo is hybrid dog breed  a cross between thePekingese and Poodle breeds. The mix makes for a wonderful companion dog who will spend their days perched on your lap or sitting by your side.Although these dogs got their start as a designer breed, you may still find them in the care of shelters and rescue groups. Adopt! Dont shop if you want to bring a dog home!These dogs are loyal and affectionate and can be quite protective of the people they love  which tends to be hilarious in such a small dog. Affectionate and playful, these pups get along with all members of the family. They can even make great companions for novice pet parents. Whether you live in an apartment or a large house with a yard, Peekapoos will make themselves at home. Theyll be happy as long as they can stay by your side. Just dont leave them home alone for too long during the day, or you may see signs of separation anxiety.",https://www.dogtime.com/assets/uploads/2011/01/file_23222_peekapoo-460x290.jpg,5,5,4,2,3,2,5,4,4,3,2,1,2,3,4,1,3,4,4,3,4,1,3,2,3,4,Hybrid Dogs,Up to 11 inches tall at the shoulder,4 to 20 pounds,10 to 15 years
pekingese,"Pekingese dogs were bred for centuries to be the cherished companions of the imperial family of China. Today theyre still cherished family companions and show dogs who greet everyone they meet with dignity and grace.Even though these are purebred dogs, you may find them in the care of shelters or rescue groups. Remember toadopt! Dont shop if you want to bring a dog home.The Peke is an adaptable dog who can live with just about anybody, including apartment dwellers and novice pet parents. However, they have a tendency to bark, which neighbors might not be too thrilled about. They also tend to stick to one human caretaker most of all. Children may injure them during rough play, so theyre best suited to homes with teens and adults. If you can meet the breeds needs, youll have a loving, loyal companion who wont want to leave your side!",https://www.dogtime.com/assets/uploads/2011/01/file_23120_pekingese-460x290.jpg,5,4,2,3,4,1,5,2,2,2,4,1,1,2,3,1,3,4,3,5,4,3,2,1,2,3,Companion Dogs,6 to 9 inches tall at the shoulder,7 to 14 pounds,12 to 15 years
pembroke welsh corgi,"Originally bred to herd cattle, sheep, and horses, the Pembroke Welsh Corgi is an active and intelligent dog breed. Easy to train and eager to learn, Pembrokes are great with children and other pets, and you can find them in four different coat colors and markings.Even though these are purebred dogs, you may find them in the care of shelters or rescue groups. Remember toadopt! Dont shop if you want to bring a dog home.Adaptable and loving with the whole family, Corgis can fit into just about any household, whether its an apartment or large home with a yard. However, they do have quite a bit of energy for a small dog. Theyll need plenty of walks and active play sessions. You might be surprised by how quickly these short-legged pups can move! For humans who can meet the breeds needs, the Pembroke will make an excellent family companion, even for novice pet parents.See below for complete list of dog breed traits and facts about Pembroke Welsh Corgis!",https://www.dogtime.com/assets/uploads/2011/01/file_23192_pembroke-welsh-corgi-460x290.jpg,4,4,4,3,4,3,5,4,3,5,5,1,4,3,4,2,5,5,2,3,5,2,4,3,4,4,Herding Dogs,10 to 12 inches tall at the shoulder,Up to 30 pounds,12 to 14 years
petit basset griffon venden,"The Petit Basset Griffon Venden is a small scent hound who has won the hearts of millions. Although the dog breed appears to be designed for winsome cuteness, in actuality, PBGVs are tough hunters who were developed for a specific purpose: to hunt small game in the rough terrain of the Vendeen region of France. The breed is known for a merry and outgoing personality.Even though these are purebred dogs, some may still end up in the care of shelters or rescues. Consider adoption if this is the breed for you.Adaptable and affectionate, these pups can fair well in apartment living situations. They do have high energy levels, though, and because of that, they need plenty of exercise. PBGVs can also have a stubborn streak, so theyll need plenty of consistent training with lots of positive reinforcement. If you can provide this pooch with lots of physical activity and care, youll be rewarded with a loving companion for the whole family, even for other resident canines.DogTime recommends this dog bed to give a good nights sleep to your medium-sized Petit Basset Griffon Venden.You should also pick up this interactive puzzle toy to keep your pup active indoors!",https://www.dogtime.com/assets/uploads/2011/01/file_23036_petit-basset-griffon-vendeen-460x290.jpg,4,3,3,3,4,3,5,5,5,5,4,1,2,3,4,2,1,4,3,5,5,5,5,4,5,5,Hound Dogs,13 to 15 inches tall at the shoulder,30 to 40 pounds,Starts at 14 years
pharaoh hound,"The Pharaoh Hound is an ancient dog breed thats changed little since their development more than 5,000 years ago. They were the dogs of kings and may have hunted gazelles with pharaohs, hence their name. This loyal hunting companion later made their way to Malta, where theyre now the national dog.Even though these are purebred dogs, some may still end up in the care of shelters or rescues. Consider adoption if this is the breed for you.You need not be royalty to befriend the Pharaoh Hound. Adaptable and affectionate, these pups make great family companions, even for novice pet parents and apartment dwellers. Pharaoh Hounds delight their humans with clownish antics and will love to make you laugh. They also have a sensitive side, though, and are even known to blush! Return this pups love in kind, and youll have a loyal friend for life.DogTime recommends this dog bed to give a good nights sleep to your medium-sized Pharaoh Hound. You should also pick up this interactive puzzle toy to keep your pup active indoors!",https://www.dogtime.com/assets/uploads/2011/01/file_23038_pharaoh-hound-460x290.jpg,4,4,5,2,1,5,5,5,5,4,2,1,4,5,3,3,3,4,4,5,4,4,2,3,4,4,Hound Dogs,21 to 25 inches tall at the shoulder,45 to 55 pounds,11 to 14 years
pitsky,"The Pitsky is a mixed breed dog  a cross between the American Pit Bull Terrier and Siberian Husky dog breeds. They range in size from medium to large, they are energetic, and loyal, these pups inherited some of the best qualities from both of their parents.Pitskies dont go by any other names  maybe because Hutbull doesnt have the same ring  just Pitsky or Husky/Pit mix or Pit/Husky mix. Despite their unfortunate status as a designer breed, you may find these mixed breed dogs in shelters and rescues. So remember to adopt! Dont shop!These high energy dogs need fast-paced lifestyles. Novice dog parents are not recommended. Pitskies are demanding and high maintenance. If you love Siberian Huskies and American Pit Bull Terriers and have experience with both, then this mixed breed may be a perfect choice for you!",https://www.dogtime.com/assets/uploads/2019/07/pitsky-mixed-dog-breed-pictures-cover.jpg,2,1,4,1,3,3,5,5,3,5,4,2,3,4,2,3,3,3,4,3,4,4,4,4,5,5,Mixed Breed Dogs,16 to 25 inches,30 to 80 pounds,12 to 16 years
plott,"The pack-hunting Plottdog breed was developed in North Carolina more than 200 years ago to hunt bear and wild boar. They are still used as hunting dogs today and have proven their worth as pack hunters. They also participate in tracking and other dog sports.Even though these are purebred dogs, some may still end up in the care of shelters or rescues. Consider adoption if this is the breed for you.Plotts are best suited to life in the country where they have plenty of room to roam. They need lots of exercise and, due to their pack hunting heritage, would likely prefer a home with at least one other resident canine. Socialization is a must with this breed. Make sure you have a high fence, wherever you live, if you bring one of these pups home, though. They love to chase and wander. Give your dog plenty of physical activity and consistent training, and youll be rewarded with a loyal companion for life.DogTime recommends this dog bed to give a good nights sleep to your medium-sized Plott.You should also pick up this dog brush and massager for your short-haired pup!",https://www.dogtime.com/assets/uploads/2011/01/file_23040_plott-460x290.jpg,1,1,4,2,2,4,4,3,5,3,2,1,5,5,3,3,4,3,3,5,1,5,4,4,5,3,Hound Dogs,20 to 27 inches tall at the shoulder,40 to 75 pounds,12 to 14 years
pocket beagle,"Smaller than the average Beagle dog breed, these compact scenthounds are merry and fun-loving. But the Pocket Beagle is still a hound and, as such, requires patience and creative training techniques to overcome their sometimes stubborn nature.Even though these are purebred dogs, you may find them in the care of shelters or rescue groups. Remember toadopt! Dont shop if you want to bring a dog home.Pocket Beagles are super affectionate with their families, including other dogs and kids. Theyre energetic and playful, too, so they make for excellent playmates. Just make sure children know how to properly and safely interact with a small dog, and supervise play sessions, as even well trained Beagles can get a little rambunctious. Apartment dwellers can also enjoy this breed, provided they can give their dogs plenty of exercise and walks. These pups get along with just about everybody! Just dont leave them home alone for too long, or they may act out in unwanted ways.",https://www.dogtime.com/assets/uploads/2011/01/file_23234_pocket-beagle-460x290.jpg,4,3,4,2,2,4,5,5,5,4,3,1,5,3,5,2,3,4,4,3,5,5,4,4,4,4,Hound Dogs,7 to 12 inches tall at the shoulder,7 to 15 pounds,Starts at 10 years
pointer,"Bred for several hundred years to point birds and small game such as rabbits, the Pointer is a versatile field dog and exceptional family dog breed. They excel in many arenas, from the field to the show ring, agility to obedience.Energetic and fun-loving, theyre well suited to active homes where theyll can be loving members of the family. Apartment dwellers beware, though. These dogs need plenty of space to play and lots of daily exercise to keep their high energy in check. Otherwise, they may find their own fun by acting out with unwanted behaviors.DogTime recommends this dog bed to give a good nights sleep to your medium-sized Pointer.You should also pick up this dog brush and massager for your short-haired pup!",https://www.dogtime.com/assets/uploads/2011/01/file_22992_pointer-460x290.jpg,1,1,3,1,2,4,5,5,5,5,3,1,5,3,3,3,5,5,5,5,3,5,5,5,5,5,Sporting Dogs,"1 foot, 11 inches to 2 feet, 4 inches tall at the shoulder",45 to 75 pounds,12 to 15 years
polish lowland sheepdog,"Originally bred for herding and guarding, the Polish Lowland Sheepdog is still an excellent working dog breed. Theyre obedient and fearless, good-natured with people and other dogs, but highly protective of their flock.Even though these are purebred dogs, you may find them in the care of shelters or rescue groups. Remember toadopt! Dont shop if you want to bring a dog home.Polish Lowland Sheedogs are intelligent, active, strong, and handsome with their characteristic multicolored, shaggy coat. In recent years, theyve gained popularity as a companion dog. Theyre highly affectionate with their human families and can even adapt to apartment life. Novice pet parents should beware, though, as these pups need plenty of exercise, and their coats need frequent grooming sessions to stay tangle free. If you can provide lots of physical activity and dont mind a bit of extra brushing, this may be the breed for you!",https://www.dogtime.com/assets/uploads/2011/01/file_23194_polish-lowland-sheepdog-460x290.jpg,4,2,4,3,4,4,5,4,3,3,1,1,1,4,3,3,4,4,3,3,2,3,4,3,4,4,Herding Dogs,17 to 20 inches tall at the shoulder,35 to 55 pounds,10 to 12 years
pomapoo,"The Pomapoo is a mixed breed dog  a cross between the Pomeranian and ToyPoodle dog breeds. Compact, intelligent, and affectionate, these pups inherited some of the best qualities from both of their parents.Pomapoos are also called Pooranian, Pompoo, and Pomeroodle. Despite their unfortunate status as a designer breed, you may find these mixed breed dogs in shelters and rescues, so remember to adopt! Dont shop!These adorable pups make great apartment dogs, and they also work well in large households. Socialize them early to bring out their best qualities and ensure a friendly, confident pup. Read on, to find out if this mixed breed is the right dog for you.",https://www.dogtime.com/assets/uploads/2019/08/pomapoo-mixed-dog-breed-pictures-cover.jpg,5,5,4,1,3,2,5,3,3,3,3,1,1,3,4,1,4,4,3,2,3,1,3,3,3,4,Mixed Breed Dogs,8 to 10 inches,5 to 15 pounds,12 to 15 years
pomchi,"The Pomchi is a mixed-breed dog  a cross between the Pomeranian and the Chihuahua dog breeds. Playful, devoted, and energetic, these small pups inherited some of the best qualities from both of their parents.Pomchis go by several names, including Pomahuahua, Chimeranian, Chi-Pom, and Pom-Chi. Despite their unfortunate status as a designer breed, you may find these mixed breed dogs in shelters and rescues. So remember to adopt! Dont shop!These adorable pups make excellent apartment dogs for active urban dwellers, and they also do well in small and single-person households. If youre looking for a small, attention-loving dog with a lot of spunk, then the Pomchi may be the right dog for you!",https://www.dogtime.com/assets/uploads/2019/08/pomchi-mixed-dog-breed-pictures-cover.jpg,4,3,3,3,2,4,4,3,3,3,3,1,2,5,4,1,3,4,4,3,4,3,3,4,3,4,Mixed Breed Dogs,6 to 10 inches,4 to 12 pounds,12 to 18 years
pomeagle,"The Pomeagle is a mixed breed dog  a cross between the Pomeranian and Beagle dog breeds. Small, affectionate, and curious by nature, these pups inherited some of the best qualities from both of their parents.Pomeagles also go by the names Beagle Pom or Pomeranian Beagle mix. Despite their unfortunate status as a designer breed, you may find these mixed breed dogs in shelters and rescues, so remember to adopt! Dont shop!These adorable pups do well in apartments and houses with fenced yards. Just make sure the yard is secure, as they have a tendency to track and follow scents. Their wanderlust could lead them into dangerous situations, like traffic. So be careful and take extra precautions.They also do well in large families with older children. Pomeagles love endless play sessions and activity. They should not be left alone for long periods. Multiple pet families would be ideal. Isolation is their biggest enemy.See below for all Pomeagle facts and mixed dog breed characteristics!",https://www.dogtime.com/assets/uploads/2019/08/pomeagle-mixed-dog-breed-pictures-cover.jpg,4,4,4,1,3,2,5,3,3,3,4,1,2,3,4,1,3,2,3,3,5,4,4,3,3,4,Mixed Breed Dogs,6 to 11 inches,5 to 25 pounds,12 to 15 years
