name,description,image,adapts_well_to_apartment_living,good_for_novice_owners,sensitivity_level,tolerates_being_alone,tolerates_cold_weather,tolerates_hot_weather,affectionate_with_family,kid_friendly,dog_friendly,friendly_toward_strangers,amount_of_shedding,drooling_potential,easy_to_groom,general_health,potential_for_weight_gain,size,easy_to_train,intelligence,potential_for_mouthiness,prey_drive,tendency_to_bark_or_howl,wanderlust_potential,energy_level,intensity,exercise_needs,potential_for_playfulness,dog_breed_group,height,weight,life_spanboxador,"The Boxador is a mixed breed of doga cross between theBoxer andLabrador Retriever dog breeds. Medium to large in size, intelligent, and totally devoted to their families, these pups inherited some of the best qualities from both of their parents.Boxadors are also known asLaboxers, Boxerlabs, and Boxerdors. Despite their unfortunate status as a designer breed, you can find these mixed breed dogs in shelters and breed specific rescues, so remember to adopt! Dont shop!Boxadors are not a great choice for novice pet owners, but if youre looking for a social, furry family companion, please step right up! Big homes with yards are ideal but not required, as long as these dogs get exercise and plenty of love and attention. Boxadors are protective of their loved ones and friendly with people, children, and other dogs. Dont leave them alone for long periods, though, or else they may become bored and destructive.DogTime recommends this big, spacious crate to give your big Boxador a place to rest and relax. You should also pick up this dog brush and massager for your short-haired pup!",https://www.dogtime.com/assets/uploads/2019/08/boxador-mixed-dog-breed-pictures-cover.jpg,2,2,3,1,2,2,5,4,4,4,4,2,5,2,4,4,5,5,3,2,3,3,5,5,5,5,Mixed Breed Dogs,23 to 25 inches,50 to 110 pounds,12 to 15 years
boxer,"Boxer dogs were originally bred to be medium-size guard dogs.Today, although they are a part of the AKCs Working Group, Boxers mostly find homes as loving family companions. That said, they still retain their high energy levels and need plenty of exercise.Square-jawed and muscular, this breed is the George Clooney of the dog worlda looker with a sense of humor and an underlying sweetness. They adore their families and will also appreciate consistent training that doesnt rely on harsh reprimands.If youre looking for a high-energy, easy-to-groom, family-friendly pooch, then this just may be the breed for you!DogTime recommends this dog bed to give a good nights sleep to your medium-sized Boxer.You should also pick up this dog fetch toy to help burn off your pups high energy!",https://www.dogtime.com/assets/uploads/2011/01/file_22916_boxer-460x290.jpg,4,3,4,1,2,1,5,4,3,4,4,2,5,2,4,3,4,4,2,3,3,3,5,5,5,5,Working Dogs,21 to 25 inches at the shoulder,60 to 70 pounds,10 to 12 years
boxerdoodle,"The Boxerdoodle is a mixed breed dog  a cross between the Boxer and Poodle dog breeds. Friendly, smart, and playful, these pups inherited some of the best qualities from both of their parents.Boxerdoodles are also sometimes known as Boxerpoos. You may find these mixed breed dogs in shelters and breed specific rescues, so remember to always adopt! Dont shop if youre looking to add one of these dogs to your home!The Boxerdoodle makes for an exceptionally playful and super friendly dog who can become a great addition to a family. They are active dogs who arent well suited to apartment living because of their innate need for exercise and play. If you have a fenced-in yard, your kids and the dog will become best play buddies; although, its always important to supervise sessions involving small children.As a heads up, due to the range of size between different types of Poodle, your Boxerdoodle could end up being anywhere from small to large in size.",https://www.dogtime.com/assets/uploads/2019/09/boxerdoodle-mixed-dog-breed-pictures-cover.jpg,1,3,3,2,3,3,4,3,4,3,2,2,3,3,4,3,4,4,2,3,2,4,4,4,4,5,Mixed Breed Dogs,10 to 25 inches,12 to 70 pounds,10 to 12 years
boxmatian,"The Boxmatian is a mixed breed dog  a cross between the Boxer and Dalmatian dog breeds. Playful, goofy, and protective, these pups inherited some of the best qualities from both of their parents.You can find these mixed breed dogs in shelters and breed specific rescues, so remember to always adopt! Dont shop if youre looking to add a Boxmatian to your home!The Boxmatian is a bit like a cartoon dog come to life! They have a larger-than-life personality and love to play and goof around. If you have one of these dogs in your home, youll be laughing a lot. Properly trained, the mixed breed is affectionate and loyal to their humans and will take on a guardian role.But be warned! Correct training from the outset is essential to offset any aggressive tendencies and destructive behavior. For these reasons, this may not be the best dog to bring into a family with small children. Boxmatians also require a lot of exercise and are not apartment dogs on any level.See below for all mixed dog breed traits and facts about Boxmatians!",https://www.dogtime.com/assets/uploads/2019/09/boxmatian-mixed-dog-breed-pictures-cover.jpg,1,2,3,2,2,4,4,3,2,1,3,2,3,5,4,5,3,4,4,3,3,4,5,4,5,4,Mixed Breed Dogs,19 to 25 inches,50 to 90 pounds,10 to 13 years
boxweiler,"The Boxweiler is a mixed breed doga cross between the Boxer and Rottweiler dog breeds. Loving, loyal, and bright, these pups inherited some of the best qualities from both of their parents.Boxweilers goes by several other names, including Box Rotty, Boxer Rottie, and Boxie Rottie. Despite their unfortunate status as a designer breed, you can find these mixed breed dogs in shelters and breed specific rescues, so remember to adopt! Dont shop!These beautiful pups have a lot of energy and can get bored quite easily. Its best if theyre in a larger home with a yard, rather than an apartment. Theyre very loyal dogs who get along well with any family size. They also make excellent guard dogs without being overly aggressive. If you want an energetic dog who will keep you on your toes, alert you to any potential dangers, and love you unconditionally, then the Boxweiler may be perfect for you!",https://www.dogtime.com/assets/uploads/2019/12/boxweiler-mixed-dog-breed-pictures-cover.jpg,2,3,4,2,3,2,5,4,4,2,3,2,3,3,4,4,4,4,2,2,3,1,4,3,4,4,Mixed Breed Dogs,21 to 27 inches,70 to 100 pounds,8 to 13 years
boykin spaniel,"Dogs of the Boykin Spaniel breed are known for their hunting skills, but they make just as good companions to families as to hunters, thanks to their smarts and their friendly confidence. The family should be an active one, however; this dog needs lots of exercise.Even though these are purebred dogs, you may find them in the care of shelters or rescue groups. Remember toadopt! Dont shop if you want to bring a dog home.These smart pups adore the human members of their families, including kids. They can even get along well with other dogs in the home with proper socialization. However, their high energy may make them a poor choice for apartment dwellers. Intelligent and playful, these dogs need plenty of physical and mental stimulation to stay happy. If you can keep up with an active pup, this may be the breed for you!",https://www.dogtime.com/assets/uploads/2011/01/file_23242_boykin-spaniel-460x290.jpg,1,3,4,3,3,4,5,5,4,3,4,1,1,2,4,3,4,4,4,2,3,4,5,5,5,4,Sporting Dogs,14 to 18 inches tall at the shoulder,25 to 40 pounds,10 to 12 years
bracco italiano,"In their native Italy, the Bracco Italiano is known as a hunting dog breed, but theyre also gaining notice as a sweet and affectionate family companion. With their long ears, droopy lips, and soulful expression, the Bracco Italiano has a distinctive look. Theyre believed to be an ancient breed, dating back to the fourth or fifth century B.C.The Bracco Italiano goes by a number of other names, including Italian Pointer, The Italian Pointing Dog, and Bracco. If this dog breed interests you, then you may find these adorable pups in shelters or breed specific rescues. Remember, its always better to adopt and not shop!These smart dogs have endless amounts of energy and do best in homes with yards. The Bracco is also well suited for all households, from single individuals to large families with children. Though they are not watchdog material, they will let you know if they sense a change in their environment. If you want an energetic dog who will keep you on your toes and love you unconditionally, the Bracco Italiano may be the right dog for you!",https://www.dogtime.com/assets/uploads/2019/11/Bracco-Italiano-dog-breed-pictures-cover.jpg,1,2,4,3,3,3,5,4,5,3,3,2,5,2,3,4,3,4,2,5,2,3,4,4,5,4,Sporting Dogs,22 to 26 inches,55 to 90 pounds,10 to 14 years
braque du bourbonnais,"The Braque du Bourbonnais is an ancient purebred pointing dog originally from the country of France. Affectionate, calm, and intelligent, these pups have some of the best qualities of any dog breed out there today.This breed goes by several other names, including Bourbonnais Pointer, Bourbonnais Pointing Dog, French Pointing Dog, French Pointer, Braques Francaises, and Braque Bourbonnais. Despite being a rare breed, you may still sometimes find these adorable pups in your local shelters and rescues, so remember to adopt! Dont shop!These affectionate pups are best suited for homes with yards and would not be recommended for apartment life. They are people-oriented and need to be around their humans, which makes them well suited for families or large households with more than one person at home. If you want a gentle and energetic pup, then the Braque du Bourbonnais may be the right dog for you!",https://www.dogtime.com/assets/uploads/2019/09/Braque-du-Bourbonnais-dog-breed-pictures-cover.jpg,1,3,3,2,2,3,5,4,4,4,2,1,4,4,1,3,4,4,3,4,3,2,5,2,5,3,Working Dogs,18 to 23 inches.,35 to 55 pounds.,12 to 15 years.
briard,"Underneath the Briards long, shaggy coat lies a bold spirit and keen intelligence. True to their French roots, they can be aloof with strangers, but are affectionate and loving toward members of their pack.Even though these are purebred dogs, you may find them in the care of shelters or rescue groups. Remember toadopt! Dont shop if you want to bring a dog home.Bred as herding and guard dogs to protect flocks and fight off predators, these canines were adopted as working dogs during World War I and used by troops as sentries, ammunition carriers, messengers, and medic dogs. Today, the Briard enjoys the life of a companion dog, but they show their versatility and working nature with their great successes in obedience, agility, conformation, herding, carting, and tracking competitions.",https://www.dogtime.com/assets/uploads/2011/01/file_23182_briard-460x290.jpg,3,3,4,3,4,3,4,5,5,2,1,1,1,3,3,4,4,4,2,3,4,5,4,4,4,4,Herding Dogs,22 to 27 inches tall at the shoulder,70 to 100 pounds,10 to 12 years
brittany,"Brittanys were bred as gundogs, and they definitely have birds on the brain. Although theyre often called Brittany Spaniels, the American Kennel Club dropped the word spaniel from this pointing breeds name in 1982.These energetic dogs are versatile family companions and hunting dogs who work more closely to hunters than other pointing breeds. If you can satisfy their high energy and exercise needs, this may be the breed for you!DogTime recommends this dog bed to give a good nights sleep to your medium-sized Brittany.You should also pick up this dog water bottle for any outdoor adventures you have with your pup!",https://www.dogtime.com/assets/uploads/2011/01/file_22956_brittany-460x290.jpg,1,3,5,1,4,3,5,5,5,4,3,5,3,4,3,3,3,5,3,5,3,4,5,3,5,5,Sporting Dogs,"1 foot, 5 inches to 1 foot, 8 inches tall at the shoulder",30 to 40 pounds,10 to 13 years
broholmer,"The Broholmer is a large purebred dog from Denmark in northern Europe. Calm, protective, and friendly, this pup has some of the best qualities of any dog breed around!Broholmers go by a couple of other names, such as the Danish Mastiff or the Danish Broholmer. You may be able find these dogs at your local shelter or rescues. Please remember to adopt! Dont shop!These protective pooches can do fine in apartments but, because of their large size, are better suited for townhomes or something larger, preferably with a yard. Theyre pack dogs and like to be around people, so larger households or families with children are perfect for them. If you want a protective, calm, large pooch who will love you unconditionally, then this may be the right dog for you!",https://www.dogtime.com/assets/uploads/2019/09/Broholmer-dog-breed-pictures-cover.jpg,2,4,3,3,3,3,5,4,3,3,3,2,4,4,3,5,4,4,3,2,3,2,3,3,3,3,Companion Dogs,22 to 30 inches.,90 to 150 pounds.,8 to 12 years.
brussels griffon,"Originally bred to hunt and kill rats, this former Belgian street dog is a distinctive and unusual dog breed. Although the Brussels Griffon is small, theyre hardly a pampered pooch. Affectionate and lively, their intelligence, sense of humor, and air of self-importance keep them one step ahead of their people, who adore their pups anyway.Although these are purebred dogs, you may still find them in shelters and rescues. Remember to adopt! Dont shop if you want to bring a dog home.Griffons adapt well to apartment life, but the neighbors might not appreciate this tiny watchdogs tendency to sound off at any sign of what they believe to be trouble. These dogs also have quite a bit of energy for their size and need lots of exercise and playtime. Novice pet parents who expect a docile lapdog might find that this pup doesnt sit still as long as they were hoping. But humans who can meet the breeds needs and keep up with training will be rewarded with a loving, loyal family member.",https://www.dogtime.com/assets/uploads/2011/01/file_23098_brussels-griffon-460x290.jpg,5,2,5,1,1,2,5,4,4,3,3,3,3,3,3,1,3,4,3,1,4,5,5,3,4,5,Companion Dogs,7 to 8 inches tall at the shoulder,7 to 12 pounds,12 to 15 years
bugg,"The Bugg is a mixed breed dog  a cross between the Boston Terrier and Pugdog breeds. Intelligent, affectionate, and spunky, these pups inherited some of the best traits from both of their parents.The Bugg is sometimes called the Pugin or simply the Boston Terrier Pug.Despite their unfortunate status as a designer breed, you can find these mixed breed dogs in shelters and breed specific rescues, so remember to adopt! Dont shop!These cute pups are great apartment and house dogs, alike. Since they dont require as much exercise as larger breeds, theyre an excellent choice for seniors or first-time owners. Still, this mix is an intelligent, playful dog, and they love being the center of attention. If you are looking for a silly pooch who will be glued to your side most of the time, this may be the right dog for you!",https://www.dogtime.com/assets/uploads/2019/12/bugg-mixed-dog-breed-pictures-cover.jpg,5,4,3,2,2,3,4,3,2,3,2,2,4,4,4,2,3,4,4,3,4,2,4,3,2,4,Mixed Breed Dogs,14 to 18 inches,10 to 25 pounds,10 to 15 years
bull arab,"The Bull Arab is a hybrid breed dog with ancestry linked to the English Bull Terrier, Greyhound, shorthair Pointers, and later, larger breeds like the Mastiff and Great Dane. Strong, loyal, and active, the Bull Arab inherited some of the best qualities from their lineage.Bull Arabs go by several names, including the Australian Pig Dog and Aussie Pig.You may find these dogs in shelters and breed specific rescues, so remember to adopt! Dont shop!These independent and energetic dogs often work as guard and hunting dogs in their native Australia. The Bull Arab was bred specifically to have the hunting and scent-tracking skills of their ancestors. When larger breeds like Mastiffs and Great Danes made their way into the bloodline, they became excellent guard dogs, too. Even though Bull Arabs are loyal to their humans, this large and sometimes intimidating dog may not be the best option for first-time adopters. This breed requires heavy socialization and training, or they can become aggressive.If you are looking for a dog who doubles as a big snuggle buddy and a guard, and you feel up to the task of consistent training, the Bull Arab might be the right dog for you!",https://www.dogtime.com/assets/uploads/2020/10/breeds-not-recognized-kennel-clubs-3.jpg,2,1,2,3,4,4,3,3,1,2,2,2,4,4,3,4,2,4,3,5,2,4,4,5,4,2,Hybrid Dogs,24 to 27 inches,60 to 95 pounds,12 to 15 years
bull-pei,"The Bull-Pei is a mixed breed doga cross between the Chinese Shar-Pei andEnglish Bulldog breeds. Medium in size, loving, and loyal, these pups inherited some of the best traits from both of their parents.Despite their unfortunate status as a designer breed, you may find these pups in shelters and breed specific rescues, so remember to adopt! Dont shop!Bull-Peis make excellent companions and guard dogs without being too large or requiring much exercise. Theyre striking to look at because of their wrinkles. Just make sure that you have the time to keep your pup clean and dry, as they are prone to getting skin infections between the wrinkles.These dogs can live in apartments or houses. If youre looking for a chill companion dog who looks quite distinguished, the Bull-Pei may be perfect for you.DogTime recommends this carrier for traveling with your small Bull-Pei.You should also pick up this dog brush and massager for your short-haired pup!",https://www.dogtime.com/assets/uploads/2020/03/bull-pei-mixed-dog-breed-pictures-cover.jpg,4,2,3,3,1,1,3,2,2,2,4,3,4,3,4,3,3,2,4,2,2,1,2,2,2,2,Mixed Breed Dogs,16 to 18 inches,35 to 65 pounds,9 to 11 years
bull terrier,"The Bull Terrier was originally developed in the 19th century as a fighting dog and, later, a fashionable companion for gentlemen, but these days theyre a family companion and show dog. Theyre a dog breed distinguished by their long, egg-shaped head.Even though these are purebred dogs, some may still end up in the care of shelters or rescues. Consider adoption if this is the breed for you.This dog is a lover, not a fighter. In fact, Bull Terriers are known for being affectionate to all the members of their household, especially children. Their friendliness and love of people also means they dont like to be left alone for long hours, though. They want to be a part of all their humans daily activities. Because they have high energy and intensity, these dogs need plenty of exercise and vigorous playtime. If you can be firm and consistent with training, stay active to keep up with your pup, and provide plenty of love and attention, then this dog may be your new best friend!DogTime recommends this dog bed to give a good nights sleep to your medium-sized Bull Terrier.You should also pick up this dog brush and massager for your short-haired pup!",https://www.dogtime.com/assets/uploads/2011/01/file_23060_bull-terrier-460x290.jpg,4,3,5,2,1,4,5,5,4,5,3,1,5,4,5,2,5,4,4,4,1,5,4,5,5,5,Terrier Dogs,21 to 22 inches tall at the shoulder,35 to 75 pounds,10 to 15 years
bullador,"The Bullador is a mixed breed doga cross between the Labrador andEnglish Bulldog breeds. These pups fall into the medium-to-large size range. Active and loyal, Bulladors inherited some of the best traits from both of their parents.Bulladors should not be confused with LabrabullsLabrador Retriever and Pit Bull mixes. Despite their unfortunate status as a designer breed, you can find these mixed pups in shelters and breed specific rescues, so remember to adopt! Dont shop!If you are a longtime dog parent and want to add a social, furry companion to your family, please step right up! Big homes with yards are ideal but not required. Bulladors can live in apartments as long as they get plenty of exercise and lots of love. Theyre protective of their loved ones and friendly with people, children, and other dogs. Dont leave them alone for long periods, though, or else they may become bored and destructive.DogTime recommends this dog bed to give a good nights sleep to your medium-sized Bullador.You should also pick up this dog brush and massager for your short-haired pup!",https://www.dogtime.com/assets/uploads/2020/02/bullador-mixed-dog-breed-pictures-cover.jpg,2,2,4,2,2,2,4,4,4,4,4,4,4,3,5,4,4,4,2,4,4,3,4,4,4,4,Mixed Breed Dogs,17 to 20 inches,50 to 90 pounds,10 to 12 years
bullboxer pit,"The Bullboxer Pit is a mixed breed dog  a cross between the Boxer and American Pit Bull Terrier dog breeds. Powerful, faithful, and energetic, these pups inherited some of the best traits from both of their parents.Bullboxer Pits are also sometimes called the Pixoter or American Bullboxer. You may find these mixed breed dogs in shelters and rescues, so remember to always adopt! Dont shop if youre looking to add one of these pups to your home!Bullboxer Pits can be loyal and protective companions, and they often bond well with children. But due to the dogs natural strength and sometimes stubborn streak, it is imperative that they are socialized both from a very young age and throughout their lifetime. Reward-based training works particularly well with this mixed breed. An attentive and responsible pet parent will bring the best out of the Bullboxer Pit.",https://www.dogtime.com/assets/uploads/2019/07/bullboxer-pit-mixed-dog-breed-pictures-cover.jpg,1,2,3,2,2,2,4,4,2,2,4,4,4,4,4,3,2,4,4,5,4,3,5,5,5,4,Mixed Breed Dogs,16 to 20 inches,50 to 80 pounds,10 to 14 years
bulldog,"The Bulldog was originally used to drive cattle to market and to compete in a bloody sport called bullbaiting. Today, theyre gentle companions who love kids.Even though these are purebred dogs, you may find them in the care of shelters or rescue groups. Remember toadopt! Dont shop if you want to bring a dog home.A brief walk and a nap on the sofa is just this dog breeds speed. Bulldogs can adapt well to apartment life and even make great companions for novice pet parents. Theyre affectionate with all members of the family and are fairly low-maintenance pups. Just make sure to keep them out of extreme weather, and also give them enough exercise, as weight gain is a risk with these dogs who are happy to spend most of the day on the couch.Did you know they make dog food specifically for Bulldogs?",https://www.dogtime.com/assets/uploads/2011/01/file_23140_bulldog-460x290.jpg,5,4,4,3,1,1,5,4,2,5,3,5,5,4,5,2,3,2,2,2,4,1,2,3,3,4,Companion Dogs,12 to 15 inches tall at the shoulder,40 to 50 pounds,8 to 12 years
bullmastiff,"The Bullmastiff dog breed is a firm and fearless family guardian. While standoffish toward strangers, theyve got a soft spot for their loved ones.Called the silent watchdog, this breed is nonetheless so mellow that they make great apartment dogs. They have short, easy-care coats, but beware: These dogs are droolers. If you can get past a little slobber, youll find a big, protective companion who will be happy to join you on adventures, so long as you save a spot on the couch for them afterward.DogTime recommends this big, spacious crate to give big Bullmastiffs a place to rest and relax.You should also pick up this dog brush and massager for your short-haired pup!",https://www.dogtime.com/assets/uploads/2011/01/file_22918_bullmastiff-460x290.jpg,3,2,4,2,4,2,5,5,4,3,1,5,5,2,5,5,3,3,3,3,4,3,2,4,3,5,Working Dogs,24 to 27 inches at the shoulder,100 to 130 pounds,8 to 10 years
bullmatian,"The Bullmatian is a mixed breed dog  a cross between the Bulldog and Dalmatian dog breeds. Loving, energetic, and friendly, these pups inherited some of the best qualities from both of their parents.You may find these mixed breed dogs in shelters and breed specific rescues, so remember to always adopt! Dont shop if youre looking to add a Bullmatian to your home!Bullmatians are top-notch companion dogs. This mixed breed is known to be loving and friendly and also does very well around children. However, this energetic dog will need a high amount of regular exercise and a variety of play sessions. If youre a rookie dog owner, then you should know that Bullmatians have a reputation for stubborness at times  theyre most likely to make a good fit for a seasoned dog owner who has a lot of experience training dogs.",https://www.dogtime.com/assets/uploads/2019/07/bullmation-mixed-dog-breed-pictures-cover.jpg,2,1,3,3,2,2,4,5,4,3,2,3,4,4,4,3,1,4,3,3,2,3,5,4,4,4,Mixed Breed Dogs,11 to 24 inches,41 to 65 pounds,8 to 12 years
cairn terrier,"The Cairn Terrier dog breed is a small working terrier developed on the Isle of Skye in Scotland. Farmers used them to rid their property of vermin, and they needed a dog with courage, tenacity, and intelligencecharacteristics still found in todays Cairn.Even though these are purebred dogs, some may still end up in the care of shelters or rescues. Consider adoption if this is the breed for you.Cairn Terriers are sensible, independent, and friendly dogs who excel as family companions. Compact and affectionate, these dogs do well in apartments and large homes with novice pet parents and experienced dog lovers, alike. They do, however, have high energy and will need their humans to keep them active with walks and play sessions. Cairn Terriers dont enjoy being left home alone for long hours during the day, so make sure you can provide them with plenty of love and attention for their well-being if you decide that this is the breed for you.DogTime recommends this carrier for traveling with your small Cairn Terrier.You should also pick up this interactive puzzle toy to keep your pup active indoors!",https://www.dogtime.com/assets/uploads/2011/01/file_23062_cairn-terrier-460x290.jpg,5,4,3,1,4,4,5,5,4,4,3,1,5,4,3,1,2,5,3,4,4,3,5,4,4,5,Terrier Dogs,9 to 10 inches tall at the shoulder,13 to 14 pounds,12 to 15 years
